ID_str,SectionNum,Section,Circumstance,Phraseology,Sender,Receiver,Type,Example,Keywords,Slots
12.4.2.5.1-b,12.4.2.5.1,,Precision approach unavailable,“PRECISION APPROACH NOT AVAILABLE DUE (reason) (alternative instructions).”,ATC,Pilot,Information,"“PRECISION APPROACH NOT AVAILABLE DUE MAINTENANCE, EXPECT VISUAL APPROACH.”",PRECISION APPROACH NOT AVAILABLE DUE,"reason, alternative instructions"
12.4.2.5.1-c,12.4.2.5.1,,Include go-around instruction,“IN CASE OF GO AROUND (instructions).”,ATC,Pilot,Information,“IN CASE OF GO AROUND CLIMB STRAIGHT AHEAD TO 2000 FEET.”,CASE AROUND,instructions
12.4.2.5.2-b,12.4.2.5.2,12.4.2.5.2 Communications,"Reply not received, continuing instructions",“REPLY NOT RECEIVED. WILL CONTINUE INSTRUCTIONS.”,ATC,Pilot,Information,—,REPLY NOT RECEIVED WILL CONTINUE INSTRUCTIONS,
12.4.2.5.3-b,12.4.2.5.3,12.4.2.5.3 Azimuth,Heading good,“HEADING IS GOOD.”,ATC,Pilot,Confirmation,—,HEADING GOOD,
12.4.2.5.3-c,12.4.2.5.3,12.4.2.5.3 Azimuth,On track,“ON TRACK.”,ATC,Pilot,Confirmation,—,TRACK,
12.4.2.5.3-d,12.4.2.5.3,12.4.2.5.3 Azimuth,Slightly off track,"“SLIGHTLY (or WELL, or GOING) LEFT (or RIGHT) OF TRACK.”",ATC,Pilot,Information,“SLIGHTLY LEFT OF TRACK.”,SLIGHTLY WELL GOING LEFT RIGHT TRACK,"or WELL, or GOING, or RIGHT"
12.4.2.5.3-e,12.4.2.5.3,12.4.2.5.3 Azimuth,Distance from track,“(number) METRES LEFT (or RIGHT) OF TRACK.”,ATC,Pilot,Information,“50 METRES LEFT OF TRACK.”,METRES LEFT RIGHT TRACK,"number, or RIGHT"
12.4.2.5.4-b,12.4.2.5.4,12.4.2.5.4 Elevation,Commence descent rate,“COMMENCE DESCENT NOW [AT (number) METRES PER SECOND OR (number) FEET PER MINUTE (or ESTABLISH A (number) DEGREE GLIDE PATH)].”,ATC,Pilot,Instruction,“COMMENCE DESCENT NOW AT 700 FEET PER MINUTE.”,COMMENCE DESCENT NOW METRES PER SECOND FEET MINUTE ESTABLISH DEGREE GLIDE PATH,"number, or ESTABLISH A (number"
12.4.2.5.4-c,12.4.2.5.4,12.4.2.5.4 Elevation,Descent rate satisfactory,“RATE OF DESCENT IS GOOD.”,ATC,Pilot,Information,—,RATE DESCENT GOOD,
12.4.2.5.4-d,12.4.2.5.4,12.4.2.5.4 Elevation,On glide path,“ON GLIDE PATH.”,ATC,Pilot,Information,—,GLIDE PATH,
12.4.2.5.4-e,12.4.2.5.4,12.4.2.5.4 Elevation,Off glide path,"“SLIGHTLY (or WELL, or GOING) ABOVE (or BELOW) GLIDE PATH.”",ATC,Pilot,Information,“SLIGHTLY BELOW GLIDE PATH.”,SLIGHTLY WELL GOING ABOVE BELOW GLIDE PATH,"or WELL, or GOING, or BELOW"
12.4.2.5.4-f,12.4.2.5.4,12.4.2.5.4 Elevation,Deviation magnitude,“[STILL] (number) METRES (or FEET) TOO HIGH (or TOO LOW).”,ATC,Pilot,Information,“STILL 150 FEET TOO LOW.”,STILL METRES FEET TOO HIGH LOW,"number, or FEET, or TOO LOW"
12.4.2.5.4-g,12.4.2.5.4,12.4.2.5.4 Elevation,Adjust rate of descent,“ADJUST RATE OF DESCENT.”,ATC,Pilot,Instruction,—,ADJUST RATE DESCENT,
12.4.2.5.4-h,12.4.2.5.4,12.4.2.5.4 Elevation,Returning to glide path,“COMING BACK [SLOWLY (or QUICKLY)] TO THE GLIDE PATH.”,ATC,Pilot,Information,—,COMING BACK SLOWLY QUICKLY GLIDE PATH,or QUICKLY
12.4.2.5.4-i,12.4.2.5.4,12.4.2.5.4 Elevation,Resume normal descent,“RESUME NORMAL RATE OF DESCENT.”,ATC,Pilot,Instruction,—,RESUME NORMAL RATE DESCENT,
12.4.2.5.4-j,12.4.2.5.4,12.4.2.5.4 Elevation,Elevation element unserviceable,“ELEVATION ELEMENT UNSERVICEABLE (to be followed by appropriate instructions).”,ATC,Pilot,Advisory,—,ELEVATION ELEMENT UNSERVICEABLE,to be followed by appropriate instructions
12.4.2.5.4-k,12.4.2.5.4,12.4.2.5.4 Elevation,Altitude check by distance,“(distance) FROM TOUCHDOWN. ALTITUDE (or HEIGHT) SHOULD BE (numbers and units).”,ATC,Pilot,Information,"“1.5 MILES FROM TOUCHDOWN, ALTITUDE SHOULD BE 500 FEET.”",FROM TOUCHDOWN ALTITUDE HEIGHT SHOULD,"distance, or HEIGHT, numbers and units"
12.4.2.5.5-b,12.4.2.5.5,12.4.2.5.5 Position,Over approach lights,“OVER APPROACH LIGHTS.”,ATC,Pilot,Information,—,OVER APPROACH LIGHTS,
12.4.2.5.5-c,12.4.2.5.5,12.4.2.5.5 Position,Over threshold,“OVER THRESHOLD.”,ATC,Pilot,Information,—,OVER THRESHOLD,
12.4.2.5.6-b,12.4.2.5.6,12.4.2.5.6 Checks,Check decision altitude/height,“CHECK DECISION ALTITUDE (or HEIGHT).”,ATC,Pilot,Instruction,—,CHECK DECISION ALTITUDE HEIGHT,or HEIGHT
12.4.2.5.7-b,12.4.2.5.7,12.4.2.5.7 Completion of Approach,Report runway lights in sight,“REPORT RUNWAY [LIGHTS] IN SIGHT.”,ATC,Pilot,Instruction,—,REPORT RUNWAY LIGHTS SIGHT,
12.4.2.5.7-c,12.4.2.5.7,12.4.2.5.7 Completion of Approach,Approach completed,“APPROACH COMPLETED [CONTACT (unit)].”,ATC,Pilot,Instruction,“APPROACH COMPLETED CONTACT TOWER.”,APPROACH COMPLETED CONTACT,unit
12.4.2.5.8-b,12.4.2.5.8,12.4.2.5.8 Missed Approach,Immediate go-around,“GO AROUND IMMEDIATELY [missed approach instructions] (reason).”,ATC,Pilot,Emergency Instruction,“GO AROUND IMMEDIATELY DUE VEHICLE ON RUNWAY.”,AROUND IMMEDIATELY,reason
12.4.2.5.8-c,12.4.2.5.8,12.4.2.5.8 Missed Approach,Query go-around,“ARE YOU GOING AROUND?”,ATC,Pilot,Query,—,ARE YOU GOING AROUND,
12.4.2.5.8-d,12.4.2.5.8,12.4.2.5.8 Missed Approach,Provide instructions if going around,“IF GOING AROUND (appropriate instructions).”,ATC,Pilot,Instruction,“IF GOING AROUND CLIMB STRAIGHT AHEAD TO 2000 FEET.”,GOING AROUND,appropriate instructions
12.4.2.5.8-e,12.4.2.5.8,12.4.2.5.8 Missed Approach,Pilot reports go-around,“GOING AROUND.”,Pilot,ATC,Report,—,GOING AROUND,
12.4.3.1-b,12.4.3.1,,Report SSR capability,“TRANSPONDER (as shown in the flight plan).”,Pilot,ATC,Report,—,TRANSPONDER,as shown in the flight plan
12.4.3.1-c,12.4.3.1,,No SSR available,“NEGATIVE TRANSPONDER.”,Pilot,ATC,Report,—,NEGATIVE TRANSPONDER,
12.4.3.10-a,12.4.3.10,,Terminate transponder,“STOP SQUAWK [TRANSMIT ADS-B ONLY].”,ATC,Pilot,Instruction,—,STOP SQUAWK TRANSMIT ADS ONLY,
12.4.3.10-b,12.4.3.10,,Stop ADS-B only,“STOP ADS-B TRANSMISSION [SQUAWK (code) ONLY].”,ATC,Pilot,Instruction,—,STOP ADS TRANSMISSION SQUAWK ONLY,code
12.4.3.11-a,12.4.3.11,,Request altitude transmission,“SQUAWK CHARLIE.”,ATC,Pilot,Instruction,—,SQUAWK CHARLIE,
12.4.3.11-b,12.4.3.11,,Transmit ADS-B altitude,“TRANSMIT ADS-B ALTITUDE.”,ATC,Pilot,Instruction,—,TRANSMIT ADS ALTITUDE,
12.4.3.12,12.4.3.12,,Altimeter check and confirm level,“CHECK ALTIMETER SETTING AND CONFIRM (level).”,ATC,Pilot,Instruction,—,CHECK ALTIMETER SETTING CONFIRM,level
12.4.3.13-a,12.4.3.13,,Stop altitude transmission (faulty),“STOP SQUAWK CHARLIE WRONG INDICATION.”,ATC,Pilot,Instruction,—,STOP SQUAWK CHARLIE WRONG INDICATION,
12.4.3.13-b,12.4.3.13,,Stop ADS-B altitude transmission,“STOP ADS-B ALTITUDE TRANSMISSION [(reason)].”,ATC,Pilot,Instruction,—,STOP ADS ALTITUDE TRANSMISSION,reason
12.4.3.14,12.4.3.14,,Request level check,“CONFIRM (level).”,ATC,Pilot,Request,—,CONFIRM,level
12.4.3.2-b,12.4.3.2,12.4.3.2 ADS-B Capability,Report ADS-B transmitter,“ADS-B TRANSMITTER (data link).”,Pilot,ATC,Report,—,ADS TRANSMITTER,data link
12.4.3.2-c,12.4.3.2,12.4.3.2 ADS-B Capability,Report ADS-B receiver,“ADS-B RECEIVER (data link).”,Pilot,ATC,Report,—,ADS RECEIVER,data link
12.4.3.2-d,12.4.3.2,12.4.3.2 ADS-B Capability,No ADS-B available,“NEGATIVE ADS-B.”,Pilot,ATC,Report,—,NEGATIVE ADS,
12.4.3.3-b,12.4.3.3,12.4.3.3 Setting Transponder,Assign code directly,“SQUAWK (code).”,ATC,Pilot,Instruction,“SQUAWK 4450.”,SQUAWK,code
12.4.3.4-b,12.4.3.4,12.4.3.4 Reselect Assigned Mode/Code,Pilot acknowledges reset,“RESETTING (mode) (code).”,Pilot,ATC,Acknowledgement,—,RESETTING,"mode, code"
12.4.3.5,12.4.3.5,,Reselect aircraft ID,“RE-ENTER [ADS-B or MODE S] AIRCRAFT IDENTIFICATION.”,ATC,Pilot,Instruction,—,ENTER ADS MODE AIRCRAFT IDENTIFICATION,
12.4.3.6-a,12.4.3.6,,Confirm code selected,“CONFIRM SQUAWK (code).”,ATC,Pilot,Request,“CONFIRM SQUAWK 3322.”,CONFIRM SQUAWK,code
12.4.3.6-b,12.4.3.6,,Pilot confirmation,“SQUAWKING (code).”,Pilot,ATC,Report,—,SQUAWKING,code
12.4.3.7-a,12.4.3.7,,Operate ident feature,“SQUAWK [(code)] [AND] IDENT.”,ATC,Pilot,Instruction,“SQUAWK 1200 AND IDENT.”,SQUAWK IDENT,code
12.4.3.7-b,12.4.3.7,,Low sensitivity,“SQUAWK LOW.”,ATC,Pilot,Instruction,—,SQUAWK LOW,
12.4.3.7-c,12.4.3.7,,Normal sensitivity,“SQUAWK NORMAL.”,ATC,Pilot,Instruction,—,SQUAWK NORMAL,
12.4.3.7-d,12.4.3.7,,Transmit ADS-B ident,“TRANSMIT ADS-B IDENT.”,ATC,Pilot,Instruction,—,TRANSMIT ADS IDENT,
12.4.3.8,12.4.3.8,,Suspend transponder,“SQUAWK STANDBY.”,ATC,Pilot,Instruction,—,SQUAWK STANDBY,
12.4.3.9,12.4.3.9,,Emergency code,“SQUAWK MAYDAY [CODE SEVEN-SEVEN-ZERO-ZERO].”,ATC,Pilot,Emergency Instruction,“SQUAWK MAYDAY 7700.”,SQUAWK MAYDAY CODE SEVEN ZERO,
12.6.1.2,12.6.1.2,,Terrain alert,"“(call sign) TERRAIN ALERT, (suggested pilot action).”",ATC,Pilot,Warning,"“WZZ431 TERRAIN ALERT, CLIMB IMMEDIATELY.”",TERRAIN ALERT,"call sign, suggested pilot action"
12.7.1.1-b,12.7.1.1,,Pilot reports engine start,“STARTING NUMBER (engine number(s)).”,Pilot,Ground Crew,Report,“STARTING NUMBER 2.”,STARTING NUMBER,engine number(s
12.7.1.2-a,12.7.1.2,,“ARE YOU READY FOR PUSHBACK?”,Ground Crew,Pilot,Query,—,,,
12.7.1.2-b,12.7.1.2,,Pilot confirms ready,“READY FOR PUSHBACK.”,Pilot,Ground Crew,Acknowledgement,—,READY PUSHBACK,
12.7.1.2-c,12.7.1.2,,Confirm brakes released,“CONFIRM BRAKES RELEASED.”,Ground Crew,Pilot,Request,—,CONFIRM BRAKES RELEASED,
12.7.1.2-d,12.7.1.2,,Pilot reports brakes released,“BRAKES RELEASED.”,Pilot,Ground Crew,Report,—,BRAKES RELEASED,
12.7.1.2-e,12.7.1.2,,Start pushback,“COMMENCING PUSHBACK.”,Ground Crew,Pilot,Report,—,COMMENCING PUSHBACK,
12.7.1.2-f,12.7.1.2,,Pushback completed,“PUSHBACK COMPLETED.”,Ground Crew,Pilot,Report,—,PUSHBACK COMPLETED,
12.7.1.2-g,12.7.1.2,,Pilot requests stop,“STOP PUSHBACK.”,Pilot,Ground Crew,Instruction,—,STOP PUSHBACK,
12.7.1.2-h,12.7.1.2,,Confirm brakes set,“CONFIRM BRAKES SET.”,Ground Crew,Pilot,Request,—,CONFIRM BRAKES SET,
12.7.1.2-i,12.7.1.2,,Pilot reports brakes set,“BRAKES SET.”,Pilot,Ground Crew,Report,—,BRAKES SET,
12.7.1.2-j,12.7.1.2,,Pilot requests disconnect,“DISCONNECT.”,Pilot,Ground Crew,Instruction,—,DISCONNECT,
12.7.1.2-k,12.7.1.2,,Ground crew acknowledges disconnect,"“DISCONNECTING, STAND BY FOR VISUAL AT YOUR LEFT (or RIGHT).”",Ground Crew,Pilot,Acknowledgement,—,DISCONNECTING STAND VISUAL YOUR LEFT RIGHT,or RIGHT
12.7.2.1-b,12.7.2.1,12.7.2.1 Prior to De-/Anti-Icing (Ground Crew ↔ Flight Crew),Pilot confirms brakes and requests treatment,"“[AFFIRM] BRAKES SET, REQUEST (type of de/anti-icing treatment and areas to be treated).”",Pilot,Ground Crew,Request,"“AFFIRM BRAKES SET, REQUEST TYPE II ON WINGS AND TAIL.”",AFFIRM BRAKES SET REQUEST,type of de/anti-icing treatment and areas to be treated
12.7.2.1-c,12.7.2.1,12.7.2.1 Prior to De-/Anti-Icing (Ground Crew ↔ Flight Crew),Ground crew confirms aircraft configuration,“HOLD POSITION AND CONFIRM AIRCRAFT CONFIGURED.”,Ground Crew,Pilot,Instruction,—,HOLD POSITION CONFIRM AIRCRAFT CONFIGURED,
12.7.2.1-d,12.7.2.1,12.7.2.1 Prior to De-/Anti-Icing (Ground Crew ↔ Flight Crew),Pilot confirms ready for de-icing,"“[AFFIRM] AIRCRAFT CONFIGURED, READY FOR DE-ICING.”",Pilot,Ground Crew,Acknowledgement,—,AFFIRM AIRCRAFT CONFIGURED READY ICING,
12.7.2.1-e,12.7.2.1,12.7.2.1 Prior to De-/Anti-Icing (Ground Crew ↔ Flight Crew),Ground crew starts procedure,“DE-ICING STARTS NOW.”,Ground Crew,Pilot,Notification,—,ICING STARTS NOW,
12.7.2.2-b,12.7.2.2,12.7.2.2 Upon Concluding De-/Anti-Icing Procedure,State fluid type used,“TYPE OF FLUID (Type I or II or III or IV).”,Ground Crew,Pilot,Information,“TYPE II.”,TYPE FLUID III,Type I or II or III or IV
12.7.2.2-c,12.7.2.2,12.7.2.2 Upon Concluding De-/Anti-Icing Procedure,State holdover start time,“HOLDOVER TIME STARTED AT (time).”,Ground Crew,Pilot,Information,“HOLDOVER TIME STARTED AT 1335.”,HOLDOVER TIME STARTED,time
12.7.2.2-d,12.7.2.2,12.7.2.2 Upon Concluding De-/Anti-Icing Procedure,State anti-icing code,“ANTI-ICING CODE (appropriate anti-icing code).”,Ground Crew,Pilot,Information,“TYPE II/75 13:35 KILFROST ABC.”,ANTI ICING CODE,appropriate anti-icing code
12.7.2.2-e,12.7.2.2,12.7.2.2 Upon Concluding De-/Anti-Icing Procedure,Report final step start time,“FINAL STEP STARTED AT (time).”,Ground Crew,Pilot,Information,“FINAL STEP STARTED AT 1340.”,FINAL STEP STARTED,time
12.7.2.2-f,12.7.2.2,12.7.2.2 Upon Concluding De-/Anti-Icing Procedure,Confirm post-check completion,“POST DE-ICING CHECK COMPLETED.”,Ground Crew,Pilot,Report,—,POST ICING CHECK COMPLETED,
12.7.2.2-g,12.7.2.2,12.7.2.2 Upon Concluding De-/Anti-Icing Procedure,Confirm all personnel clear,“PERSONNEL AND EQUIPMENT CLEAR OF AIRCRAFT.”,Ground Crew,Pilot,Report,—,PERSONNEL EQUIPMENT CLEAR AIRCRAFT,
12.7.2.3-b,12.7.2.3,12.7.2.3 Abnormal Operations,Emergency in de-icing bay,“EMERGENCY IN DE-ICING BAY (number) [SHUT DOWN ENGINES or STANDBY FOR FURTHER INSTRUCTIONS].”,Ground Crew,Pilot,Emergency Instruction,“EMERGENCY IN DE-ICING BAY 2 SHUT DOWN ENGINES.”,EMERGENCY ICING BAY SHUT DOWN ENGINES STANDBY FURTHER INSTRUCTIONS,number
12.1,12.1,12.1 COMMUNICATIONS PROCEDURES,General compliance requirement,“The communications procedures shall be in accordance with Annex 10 Vol II — Aeronautical Telecommunications.”,ICAO Standard,All ATS personnel and pilots,Rule / Requirement,—,,
12.2,12.2,12.2 GENERAL,Readback of clearances and safety-related information,Requirements in Chapter 4 § 4.5.7.5 apply for readbacks.,ATC ↔ Pilot,Bidirectional,Safety procedure,—,,
12.2.1,12.2.1,12.2.1 Plain language use,When standard phraseology not sufficient,Use plain language that is clear and concise to ICAO proficiency level.,ATC / Pilot,Both,Language requirement,—,ICAO,
12.2.10,12.2.10,12.2.10 Examples of use,Where to find examples,“Examples are found in the Manual of Radiotelephony (Doc 9432).”,ICAO Standard,All ATS users,Reference,—,,Doc 9432
12.2.2,12.2.2,12.2.2 Grouping of phraseologies,Reference to types of air traffic service,Phraseologies are grouped by ATS type but users must know others as necessary; use with call signs.,ATC / Pilot,Both,Instruction,—,ATS,
12.2.3,12.2.3,12.2.3 Users of phraseologies,Applicability,"Phrases in § 12.3 used by pilots, ATS and ground personnel.",ICAO Standard,All ATS participants,Definition,—,ATS,
12.2.4-a,12.2.4,12.2.4 RVSM non-approved status reporting,Pilot operating non-RVSM-approved aircraft within RVSM airspace — initial call,“NEGATIVE RVSM (aircraft type or reason).”,Pilot,ATC,Report / Status,“NEGATIVE RVSM STATE AIRCRAFT.”,NEGATIVE RVSM,aircraft type or reason
12.2.5,12.2.5,12.2.5 Acknowledgement of non-RVSM status,Controller receives message about non-approval,ATC must explicitly acknowledge receipt.,ATC,Pilot,Acknowledgement,“ROGER NEGATIVE RVSM.”,ATC,
12.2.6,12.2.6,12.2.6 Vehicle phraseology,When communicating with ground vehicles,Use same phrases as for aircraft except replace “TAXI” with “PROCEED”.,ATC,Vehicle operator,Ground movement,“PROCEED VIA ALPHA TO STAND 12.”,TAXI PROCEED,
12.2.7-a,12.2.7,12.2.7 Conditional clearances,Conditional clearance — identification first,Structure of conditional clearance: (a) Identification,ATC,Pilot,Clearance rule,“SAS 941…”,,
12.2.8,12.2.8,12.2.8 Scope of listed phrases,Clarification,Annex 10 Vol II procedure words not repeated here.,ICAO Standard,—,Reference,—,,
12.2.9,12.2.9,12.2.9 Parentheses and brackets,Notation rules in text,Parentheses = mandatory insertion; square brackets = optional.,ICAO Standard,Users of Doc 4444,Formatting rule,—,,
12.3.1.1-a,12.3.1.1,12.3.1.1 Description of Levels,Assigning flight level by altimeter setting,“FLIGHT LEVEL (number).”,ATC,Pilot,Level designation,“FLIGHT LEVEL 350.”,FLIGHT LEVEL,number
12.3.1.10-a,12.3.1.10,12.3.1.10 Additional Reports,Request report passing point,“REPORT PASSING (significant point).”,ATC,Pilot,Instruction,“REPORT PASSING BALASSAGYARMAT.”,REPORT PASSING,significant point
12.3.1.11-a,12.3.1.11,12.3.1.11 Aerodrome Information,Report runway surface condition,“(location) RUNWAY SURFACE CONDITION RUNWAY (number) (condition).”,ATC,Pilot,Information,“BUDAPEST RUNWAY SURFACE CONDITION RUNWAY 31 WET.”,RUNWAY SURFACE CONDITION,"location, number, condition"
12.3.1.11-i,12.3.1.11,12.3.1.11 Aerodrome Information,Report runway/taxiway surface condition,"“RUNWAY (or TAXIWAY) (number) WET [or STANDING WATER, or SNOW REMOVED, or TREATED, or COVERED WITH PATCHES OF (surface type)].”",ATC,Pilot,Runway Condition,“RUNWAY 31 COVERED WITH PATCHES OF COMPACTED SNOW.”,RUNWAY TAXIWAY WET STANDING WATER SNOW REMOVED TREATED COVERED PATCHES,"or TAXIWAY, number, surface type"
12.3.1.12-a,12.3.1.12,12.3.1.12 Operational Status of Visual and Non-visual Aids,Report deficiency of runway aid,“(visual or non-visual aid) RUNWAY (number) (description of deficiency).”,ATC,Pilot,Advisory,“ILS RUNWAY 31 OUT OF SERVICE.”,RUNWAY,"visual or non-visual aid, number, description of deficiency"
12.3.1.13-a,12.3.1.13,12.3.1.13 RVSM Operations,Confirm RVSM approval,“CONFIRM RVSM APPROVED.”,ATC,Pilot,Query,—,CONFIRM RVSM APPROVED,
12.3.1.14-a,12.3.1.14,12.3.1.14 GNSS Service Status,Report GNSS unreliability or unavailability area,“GNSS REPORTED UNRELIABLE (or MAY NOT BE AVAILABLE) [IN THE VICINITY OF (location)/(area)] [BETWEEN (levels)].”,ATC,Pilot,Advisory,“GNSS MAY NOT BE AVAILABLE IN THE VICINITY OF PRAGUE BETWEEN FL 300–400.”,GNSS REPORTED UNRELIABLE MAY NOT AVAILABLE VICINITY BETWEEN,"or MAY NOT BE AVAILABLE, location, area, levels"
12.3.1.15,12.3.1.15,12.3.1.15 Degradation of Navigation Performance,Report degraded navigation capability,“UNABLE RNP (specify type) (or RNAV) [DUE TO (reason)].”,Pilot,ATC,Report,“UNABLE RNP 1 DUE TO RAIM ALERT.”,UNABLE RNP RNAV DUE,"specify type, or RNAV, reason"
12.3.1.2-a,12.3.1.2,"12.3.1.2 Level Changes, Reports and Rates",Instruct climb or descent,“CLIMB (or DESCEND).”,ATC,Pilot,Clearance,“CLIMB.”,CLIMB DESCEND,or DESCEND
12.3.1.2-a,12.3.1.2,12.3.1.2 Level Changes / Reports and Rates,Instruct climb or descent,“CLIMB (or DESCEND).”,ATC,Pilot,Clearance,“CLIMB.”,CLIMB DESCEND,or DESCEND
12.3.1.2-b,12.3.1.2,"12.3.1.2 Level Changes, Reports and Rates",Maintain vertical separation from another aircraft,“MAINTAIN AT LEAST (number) METRES (or FEET) ABOVE (or BELOW) (aircraft call sign).”,ATC,Pilot,Separation Instruction,“MAINTAIN AT LEAST 1000 FEET ABOVE SAS 941.”,MAINTAIN LEAST METRES FEET ABOVE BELOW,"number, or FEET, or BELOW, aircraft call sign"
12.3.1.2-b,12.3.1.2,12.3.1.2 Level Changes / Reports and Rates,Maintain vertical separation from another aircraft,“MAINTAIN AT LEAST (number) METRES (or FEET) ABOVE (or BELOW) (aircraft call sign).”,ATC,Pilot,Separation Instruction,“MAINTAIN AT LEAST 1000 FEET ABOVE SAS 941.”,MAINTAIN LEAST METRES FEET ABOVE BELOW,"number, or FEET, or BELOW, aircraft call sign"
12.3.1.3-a,12.3.1.3,12.3.1.3 Minimum Fuel,Pilot indicates minimum fuel status,“MINIMUM FUEL.”,Pilot,ATC,Status Report,“MINIMUM FUEL.”,MINIMUM FUEL,
12.3.1.4-a,12.3.1.4,12.3.1.4 Transfer of Control / Frequency Change,Instruct aircraft to contact unit,“CONTACT (unit call sign) (frequency) [NOW].”,ATC,Pilot,Instruction,“CONTACT VIENNA CONTROL 118.525 NOW.”,CONTACT NOW,"unit call sign, frequency"
12.3.1.4-e,12.3.1.4,12.3.1.4 Transfer of Control / Frequency Change,Pilot requests frequency change,“REQUEST CHANGE TO (frequency).”,Pilot,ATC,Request,“REQUEST CHANGE TO 119.1.”,REQUEST CHANGE,frequency
12.3.1.5-a,12.3.1.5,12.3.1.5 8.33 kHz Channel Spacing,Request confirmation of 8.33 capability,“CONFIRM EIGHT POINT THREE THREE.”,ATC,Pilot,Query,—,CONFIRM EIGHT POINT THREE,
12.3.1.6-a,12.3.1.6,12.3.1.6 Change of Call Sign,Instruct aircraft to change call sign,“CHANGE YOUR CALL SIGN TO (new call sign) [UNTIL FURTHER ADVISED].”,ATC,Pilot,Instruction,“CHANGE YOUR CALL SIGN TO SPEEDBIRD 123 UNTIL FURTHER ADVISED.”,CHANGE YOUR CALL SIGN UNTIL FURTHER ADVISED,new call sign
12.3.1.7-a,12.3.1.7,12.3.1.7 Traffic Information,Passing traffic information,“TRAFFIC (information).”,ATC,Pilot,Information,"“TRAFFIC TWO O’CLOCK, THREE MILES, SAME LEVEL.”",TRAFFIC,information
12.3.1.8-a,12.3.1.8,12.3.1.8 Meteorological Conditions,Report surface wind,“[SURFACE] WIND (number) DEGREES (speed) (units).”,ATC,Pilot,Weather Information,“WIND 270 DEGREES 10 KNOTS.”,SURFACE WIND DEGREES,"number, speed, units"
12.3.1.9-a,12.3.1.9,12.3.1.9 Position Reporting,Specify next report point,“NEXT REPORT AT (significant point).”,ATC,Pilot,Instruction,“NEXT REPORT AT VOR PEST.”,NEXT REPORT,significant point
12.3.2.1-a,12.3.2.1,12.3.2.1 Issuance of a Clearance,ATC issues clearance,“(unit name) CLEARS (aircraft call sign).”,ATC,Pilot,Clearance,“BUDAPEST CONTROL CLEARS KLM123.”,CLEARS,"unit name, aircraft call sign"
12.3.2.2-a,12.3.2.2,12.3.2.2 Indication of Route and Clearance Limit,Specify route segment,“FROM (location) TO (location).”,ATC,Pilot,Route Specification,“FROM BRNO TO BUDAPEST.”,FROM,location
12.3.2.3-a,12.3.2.3,12.3.2.3 Maintenance of Specified Levels,Maintain level to point,“MAINTAIN (level) [TO (point)].”,ATC,Pilot,Instruction,“MAINTAIN FL 120 TO LOMED.”,MAINTAIN,"level, point"
12.3.2.4-a,12.3.2.4,12.3.2.4 Specification of Cruising Levels,Cross point at or above/below level,"“CROSS (point) AT (or ABOVE, or BELOW) (level).”",ATC,Pilot,Instruction,“CROSS LOMED AT OR ABOVE FL 190.”,CROSS ABOVE BELOW,"point, or ABOVE, or BELOW, level"
12.3.2.5-a,12.3.2.5,12.3.2.5 Emergency Descent,Pilot announces emergency descent intentions,“EMERGENCY DESCENT (intentions).”,Pilot,ATC,Emergency,“EMERGENCY DESCENT DUE LOSS OF PRESSURE.”,EMERGENCY DESCENT,intentions
12.3.2.6,12.3.2.6,12.3.2.6 If Clearance Cannot Be Issued Immediately,Clearance cannot be issued at once,“EXPECT CLEARANCE (or type of clearance) AT (time).”,ATC,Pilot,Delay Instruction,“EXPECT CLEARANCE AT 1045.”,EXPECT CLEARANCE,"or type of clearance, time"
12.3.2.7,12.3.2.7,12.3.2.7 When Clearance for Deviation Cannot Be Issued,Deny deviation due traffic,"“UNABLE, TRAFFIC (direction) BOUND (type) (level) ESTIMATED (or OVER) (point) AT (time) CALL SIGN (call sign) ADVISE INTENTIONS.”",ATC,Pilot,Denial / Coordination,"“UNABLE, TRAFFIC NORTHBOUND B737 FL310 OVER PUSTA AT 1220 CALL SIGN WZZ431 ADVISE INTENTIONS.”",UNABLE TRAFFIC BOUND ESTIMATED OVER CALL SIGN ADVISE INTENTIONS,"direction, type, level, or OVER, point, time, call sign"
12.3.2.8-a,12.3.2.8,12.3.2.8 Separation Instructions,Crossing at time,“CROSS (point) AT (time) [OR LATER/BEFORE].”,ATC,Pilot,Separation,“CROSS GILEP AT 1215.”,CROSS LATER BEFORE,"point, time"
12.3.2.9-a,12.3.2.9,12.3.2.9 Instructions Associated with Flying an Offset Track,Ability to fly offset,“ADVISE IF ABLE TO PROCEED PARALLEL OFFSET.”,ATC,Pilot,Query,—,ADVISE ABLE PROCEED PARALLEL OFFSET,
12.3.3.1-a,12.3.3.1,12.3.3.1 Departure Instructions,Departure turn or climb,“[AFTER DEPARTURE] TURN RIGHT (or LEFT) HEADING (three digits) (or CONTINUE RUNWAY HEADING) (or TRACK EXTENDED CENTRE LINE) TO (level or point).”,ATC,Pilot,Departure Instruction,“AFTER DEPARTURE TURN LEFT HEADING 270 TO FL 80.”,AFTER DEPARTURE TURN RIGHT LEFT HEADING CONTINUE RUNWAY TRACK EXTENDED CENTRE LINE,"or LEFT, three digits, or CONTINUE RUNWAY HEADING, or TRACK EXTENDED CENTRE LINE, level or point"
12.3.3.2-a,12.3.3.2,12.3.3.2 Approach Instructions,Clearance for arrival procedure,“CLEARED (designation) ARRIVAL.”,ATC,Pilot,Clearance,“CLEARED TULSI TWO ALPHA ARRIVAL.”,CLEARED ARRIVAL,designation
12.3.3.3-a,12.3.3.3,12.3.3.3 Holding Clearances,Visual hold,“HOLD VISUAL [OVER] (position) (or BETWEEN (two landmarks)).”,ATC,Pilot,Holding Instruction,“HOLD VISUAL OVER FIELD.”,HOLD VISUAL OVER BETWEEN,"position, or BETWEEN (two landmarks"
12.3.3.3-e,12.3.3.3,12.3.3.3 Holding Clearances,Clearance to hold on VOR radial at DME fix,“CLEARED TO THE (three digits) RADIAL OF THE (name) VOR AT (distance) DME FIX [MAINTAIN/CLIMB/DESCEND TO (level)] HOLD (direction) [RIGHT/LEFT HAND PATTERN] [OUTBOUND TIME (minutes)] EXPECT APPROACH CLEARANCE AT (time).”,ATC,Pilot,Holding Clearance,“CLEARED TO THE 270 RADIAL OF WIEN VOR AT 10 DME HOLD EAST EXPECT APPROACH CLEARANCE AT 1230.”,CLEARED RADIAL VOR DME FIX MAINTAIN CLIMB DESCEND HOLD RIGHT LEFT HAND PATTERN OUTBOUND TIME EXPECT APPROACH CLEARANCE,"three digits, name, distance, level, direction, minutes, time"
12.3.3.4-a,12.3.3.4,12.3.3.4 Expected Approach Time,No delay expected,“NO DELAY EXPECTED.”,ATC,Pilot,Information,—,DELAY EXPECTED,
12.3.4.1,12.3.4.1,12.3.4.1 Identification of Aircraft,Request visual identification,“SHOW LANDING LIGHTS.”,ATC,Pilot,Visual Identification,—,SHOW LANDING LIGHTS,
12.3.4.10-a,12.3.4.10,12.3.4.10 Preparation for Take-off,Unable to issue departure clearance,“UNABLE TO ISSUE (designator) DEPARTURE (reason).”,ATC,Pilot,Advisory,“UNABLE TO ISSUE BUDAPEST ONE ALPHA DEPARTURE DUE TRAFFIC.”,UNABLE ISSUE DEPARTURE,"designator, reason"
12.3.4.11-a,12.3.4.11,12.3.4.11 Take-off Clearance,Standard take-off clearance,“RUNWAY (number) CLEARED FOR TAKE-OFF [REPORT AIRBORNE].”,ATC,Pilot,Clearance,“RUNWAY 31 CLEARED FOR TAKE-OFF REPORT AIRBORNE.”,RUNWAY CLEARED TAKE OFF REPORT AIRBORNE,number
12.3.4.12-a,12.3.4.12,12.3.4.12 Turn or Climb Instructions After Take-off,Pilot requests turn,“REQUEST RIGHT (or LEFT) TURN.”,Pilot,ATC,Request,—,REQUEST RIGHT LEFT TURN,or LEFT
12.3.4.13-a,12.3.4.13,12.3.4.13 Entering Aerodrome Traffic Circuit,Pilot position report for landing,“[Aircraft type] (position) (level) FOR LANDING.”,Pilot,ATC,Report,“CESSNA DOWNWIND 1500 FEET FOR LANDING.”,LANDING,"position, level"
